{
  "_comment": "Level 2 (Full) conformant audit trail export — AI Decision Logging Specification v0.1.0",
  "audit_trail_id": "a1b2c3d4-e5f6-7890-abcd-ef1234567890",
  "schema_version": "0.1.0",
  "created_at": "2026-03-10T09:00:00Z",
  "period": {
    "from": "2026-03-09T00:00:00Z",
    "to": "2026-03-09T23:59:59Z"
  },
  "system_id": "anomaly-detection-prod-eu",
  "operator_id": "org-acme-prod",
  "model_version": "anomaly-detector-v1.4",
  "policy_version": "ops-anomaly-policy-v1.4",
  "artifact_certificate_id": "233805c1-a1b2-4c3d-8e9f-0a1b2c3d4e5f",
  "artifact_certificate_url": "https://certifieddata.io/verify/233805c1-a1b2-4c3d-8e9f-0a1b2c3d4e5f",
  "total_decisions": 2,
  "sterilized": false,
  "decisions": [
    {
      "decision_id": "1a2b3c4d-5e6f-7890-aaaa-111111111111",
      "timestamp": "2026-03-09T08:00:00Z",
      "schema_version": "0.1.0",
      "model_version": "anomaly-detector-v1.4",
      "policy_version": "ops-anomaly-policy-v1.4",
      "session_id": "sess-20260309-prod-0001",
      "artifact_certificate_id": "233805c1-a1b2-4c3d-8e9f-0a1b2c3d4e5f",
      "input_reference": "sha256:f1e2d3c4...batch-20260309T080000Z",
      "decision_output": "NORMAL",
      "confidence_score": 0.98,
      "why": "All metrics within expected range. No anomaly detected.",
      "factors": ["all_metrics_nominal", "no_adjacent_alerts"],
      "human_oversight_flag": false,
      "operator_id": "org-acme-prod",
      "system_id": "anomaly-detection-prod-eu",
      "jurisdiction": "EU",
      "sterilized": false,
      "record_hash": "sha256:aaaa1111bbbb2222cccc3333dddd4444eeee5555ffff6666aaaa1111bbbb2222cc",
      "previous_hash": null
    },
    {
      "decision_id": "6d8c0f0a-8e8f-4e5a-bba3-04f8f1cdb1e4",
      "timestamp": "2026-03-09T17:21:00Z",
      "schema_version": "0.1.0",
      "model_version": "anomaly-detector-v1.4",
      "policy_version": "ops-anomaly-policy-v1.4",
      "session_id": "sess-20260309-prod-7f4a",
      "artifact_certificate_id": "233805c1-a1b2-4c3d-8e9f-0a1b2c3d4e5f",
      "input_reference": "sha256:a3f1c29d...batch-20260309T172000Z",
      "decision_output": "NORMAL",
      "confidence_score": 0.97,
      "why": "Metric deviation within normal seasonal bounds. No latency spike detected.",
      "factors": ["seasonality_accounted", "no_latency_spike", "anomaly_score_0.03"],
      "human_oversight_flag": false,
      "operator_id": "org-acme-prod",
      "system_id": "anomaly-detection-prod-eu",
      "jurisdiction": "EU",
      "sterilized": false,
      "record_hash": "sha256:2dce29deee5d05d28399b4b4e85a9df4a8b5e6c7d8e9f0a1b2c3d4e5f6a7b8c9",
      "previous_hash": "sha256:aaaa1111bbbb2222cccc3333dddd4444eeee5555ffff6666aaaa1111bbbb2222cc"
    }
  ],
  "chain_integrity": {
    "first_record_hash": "sha256:aaaa1111bbbb2222cccc3333dddd4444eeee5555ffff6666aaaa1111bbbb2222cc",
    "last_record_hash": "sha256:2dce29deee5d05d28399b4b4e85a9df4a8b5e6c7d8e9f0a1b2c3d4e5f6a7b8c9",
    "chain_verified": true,
    "verification_timestamp": "2026-03-10T09:00:01Z"
  },
  "integrity": {
    "signature_algorithm": "Ed25519",
    "public_key_url": "https://certifieddata.io/.well-known/signing-keys.json",
    "signature": "Ed25519:<base64url-encoded-signature-over-canonical-export-body>"
  }
}
